,Unnamed: 0,title,sub_title,intro,link_url,image_url
1810,,국립심포니오케스트라 DR’s Pick II ‘수수께끼’,클래식 ,"라벨의 마법같은 음악과 엘가의 따스함을 연주한다. 익살스러움을 가미한 이번 정기연주회의 프로그램은 8월의 무더위를 날리기에 적절한 음악적 유머러스함까지 갖추었다. 무겁기만한 클래식 음악은 벗어던지고, 작곡가가 무슨 이야기를 할까 기대되는, 그런 재미있는 클래식 음악의 매력을 어필한다. 사실 라벨의 어미 거위 모음곡도, 엘가의 수수께끼 변주곡도 작곡가와 관련된 누군가를 기쁘게 해주기 위해 작곡된 음악이라고 하니, 국립심포니의 연주도 관객들을 기쁘게 만들 수 있지 않을까 기대해 본다.",,
1811,,싱크넥스트22 김치앤칩스 `콜렉티브 비해비어`,클래식 ,"집단이나 군중 속에서의 사람들의 행동을 의미하는 ‘콜렉티브 비해비어(Collective Behaviour)’. 자아와 타자, 자유의지와 집단행동, 개인의 정체성과 집단 동질성...대립적이지만 양립할 수밖에 없는 항들이다. 그 아슬아슬한 긴장관계를 김치앤칩스 특유의 시각 효과와 시몬느 뷔로드의 절제된 안무로 표현한다. 무대 위 설치된 거울과 조명은 시공간을 왜곡하며 무용수들의 움직임을 불규칙적으로 복제해 실체에 대한 혼돈을 가중시킨다.",,
1812,,영국 린고씨어터 내한_ Craft Series 2. 연극 〈장화 신은 고양이〉,가족/아동 ,"방앗간을 운영했던 아버지가 세상을 떠나면서 세 아들에게 유산을 남긴다. 첫째에게는 방앗간을, 둘째에게는 당나귀를, 셋째에게는 고양이 한 마리를 물려주는데… 그 고양이가 장화를 신고 말을 건다？! 과연 고양이의 종횡무진 활약은 어디까지일까？",,
1813,,지킬 앤 하이드 - 여수,뮤지컬 ,"지금 이 순간, 단 하나의 선택! 뮤지컬 <지킬앤하이드> 대한민국 뮤지컬 역사상 가장 압도적인 흥행작. 2004년 국내 초연 이후 누적 회차 1,410회, 평균 객석 점유율 95%, 누적 관객수 150만 명을 돌파한 그 누구도 넘볼 수 없는 명성! 대한민국 뮤지컬의 절대적 기준이자 살아있는 신화 <지킬앤하이드>가 오디컴퍼니 창립 20주년 세 번째 라인업으로 돌아온다. 당신의 심장을 뛰게 할 전율의 무대. 대중적으로 큰 사랑을 받고 있는 대표곡 'This is the Moment', 아름답고 서정적인 선율의 'Someone Like You', 'Once Upon a Dream', 숨이 멎을 듯 강렬한 'Alive', 'The Confrontation'까지! 한국인이 ...",,
1814,,앤서니브라운의 돼지책 - 고양,가족/아동 ,집안일은 엄마만 한다?! 아주 중요한 회사에 다니는 피곳씨와 아주 중요한 학교에 다니는 사이먼과 패트릭은 집안에서 아무 일도 하지 않습니다. 왜냐하면 집안일은 엄마가 하는 거니까요. 피곳 부인 역시 직장에 나가지만 가족들에게는 별로 중요하지 않습니다.,,
1815,,사운드 오브 뮤직 - 대전,가족/아동 ,음악을 사랑하는 말괄량이 수녀 견습생 마리아는 원장 수녀의 추천으로 군인 폰 트랩가의 가정교사로 들어가게 된다. 폰트랩은 아내를 잃고 아이들에게 마음을 열지 못하는 차가운 아버지다.,,
1816,,애니메이션 첼로 페스티벌: 디즈니 VS 지브리,클래식 ,스튜디오 지브리와 디즈니의 베스트 OST를 10대의 첼로가 모여 환상의 하모니로 선보이는 한여름 밤의 꿈같은 공연이 뜨거운 성원에 힘입어 돌아온다! ‘아르츠 10 첼리스트’의 완성도 높은 연주로 원곡보다 한층 감성적이고 다채로워진 음악들을 감상할 수 있는 특별한 기회!,,
1817,,미니특공대 애니멀트론 - 천안,가족/아동 ,애니멀트론 종족에게 봉인되었던 몬스터 에그킹들이 감옥 탈출에 성공하게 되고 자신들만의 행성인 '에그킹 플레닛'을 건설하기 위해 우주에서 가장 아름다운 별인 지구를 정복할 계획을 세운다.,,
1818,,엘사의 생일파티 - 이천,가족/아동 ,오늘은 기쁜 날. 엘사 언니 생일날. 친구들을 초대해서 축하해 주고 파티를 열어야겠어요! 동화 속 공주님들을 모두 초대해서 친구들과 함께 축하해 주고 파티를 연다면 언니가 정말 좋아하겠죠?,,
1819,,매직오브아트 - 부산,가족/아동 ,"블루아트컴퍼니가 기획한 마술 콘서트 매직 오브 아트는 공연속에서 신기함, 웃음, 재미, 감동을 느낄 수 있도록 단락이 구성 되어있습니다. 블루아트컴퍼니의 색깔이 가득한 매직 오브 아트!!!! 관객들에게 특별한 추억을 드리겠습니다.",,
1820,,인어공주 - 대구,가족/아동 ,바다 왕국을 지배하는 라이톤 대왕에게는 7명의 딸이 있다. 그 중 막내딸인 에리얼은 언제나 바다 위 인간들의 세상에 나가 길 원한다. 어느 날 폭풍으로 인해 인간 세상의 에릭 왕자가 바다에 빠지고 에리얼이 왕자를 구한다.,,
1821,,노부스 콰르텟 베토벤 현악사중주 전곡 연주 3,클래식 ,창립 15주년을 맞이한 실내악 명가 목프로덕션의 월드클래스 콰르텟 기획이자 결성 15주년을 맞이한 노부스 콰르텟의 BEETHOVEN STRING QUARTET COMPLETE 오직 베토벤! 결성 15주년을 맞이한 노부스 콰르텟의 여정이 향하는 지향점과도 같은 무대가 관객들을 찾아온다,,
1822,,2022 세종솔로이스츠의 힉엣눙크！－이화윤 비올라 리사이틀,클래식 ,"클래식의 현재와 미래가 여기에. 1994년에 창단한 이래 끊임없는 찬사를 받으며 대한민국을 넘어 세계적인 현악 오케스트라로 자리매김한 세종솔로이스츠. 2017년부터 세종솔로이스츠가 야심 차게 선보인 ‘힉엣눙크! 페스티벌’이 올해 2022년에도 어김없이 찾아왔습니다. ‘여기 그리고 지금’이라는 라틴어에서 이름을 가지고 온 ‘힉엣눙크! 페스티벌’은 그 의미에 걸맞은 참신하고 혁신적인 프로그램으로 대체 불가능한 명성을 쌓아왔습니다. 오는 8월 16일부터 9월 6일까지 이어질 이번 ‘2022 힉엣눙크! 페스티벌’은 그래미 노미네이션에 빛나는 바이올리니스트 필립 퀸트와 뉴욕 필하모닉의 악장 프랭크 황,...",,
1823,,한화생명과 함께하는 예술의전당 11시 콘서트(8월),클래식 ,"매월 두 번째 목요일 아침, 향긋한 커피 향과 함께 찾아오는 예술의전당 <11시 콘서트> 2022년 Season 18에는 부드러운 저음을 가진 새로운 해설자 성악가 손태진과 함께 국내외에서 활발하게 활동하는 실력파 신진 지휘자와 솔리스트의 무대로 꾸며질 예정입니다. 강남심포니·과천시향·프라임필·코리아쿱·한경arte필하모닉과의 호흡으로 풍성하고 다채로운 클래식 음악의 향연을 즐기실 수 있습니다.",,
1824,,싱크넥스트22 뮤지컬 `원더보이`,뮤지컬 ,"서울시뮤지컬단이 김연수 작가의 동명 소설 '원더보이'를 무대화한다. 문학적 형식미가 돋보이는 원작 소설을 음악 중심의 무대언어로 전환, 파격적이고 새로운 형식의 창작 뮤지컬을 선보일 예정이다. ",,
1825,,시규어 로스 내한 공연（Sigur Ros Live in Seoul）,콘서트 ,"아이슬란드 밴드 시규어 로스(Sigur Ros)가 8월 19일(금) 올림픽공원 내 SK 핸드볼경기장에서 6년 만에 단독 내한공연을 펼친다. 이들의 무대는 세계 최정상의 사운드와 영상미가 어우러진 독보적이고 신비로운 퍼포먼스로 거대한 작품을 보는 듯한 환상에 빠져들게 한다. 때문에 꼭 한번은 경험해야 할 가치가 충분하다. 이번 내한 공연은 2013년에 탈퇴한 키보드 연주자 캬르탄 스베인손(Kjartan Sveinson)이 9년 만에 재합류, 완전체로 펼쳐질 예정이어서 팬들의 관심은 더욱 크다. 시규어 로스는 1994년 아이슬란드에서 결성한 록 밴드로 1997년 첫 앨범 ‘Von’을 발매 후, 2000년대에 들어서 ‘( )’, ‘Takk’...",,
1826,,얼 킴〈오렌지 입술의 소녀〉,클래식 ,"한국명 김을, 미국명 Earl Kim. 한국계 2세로 미국 음악계의 중심에서 활동했던 얼 킴의 작품을 2022년 8월, 세종솔로이스츠가 대한민국으로 불러들입니다. 1920년 미국 캘리포니아의 디누바에서 한국계 이민 1세대 가정에서 태어난 작곡가 얼 킴은 프린스턴과 하버드 대학에서 교편을 잡아 수많은 작곡가를 가르쳤던 교육자이자, 바이올리니스트 이츠하크 펄먼의 연주로 초연되었던 <바이올린 협주곡>과 여러 문학작품에 음악을 더한 다수의 작품으로 그 이름을 생전 널리 알린 거장이었습니다. 세종솔로이스츠는 지난 1998년 78세의 나이로 세상을 떠난 작곡가의 작품을 이전부터 알려오는 데 적극적인 노력...",,
1827,,아기돼지 삼형제 - 대구,가족/아동 ,아기돼지 삼 형제의 엄마는 자식들의 자립심을 키워주기 위해 편지 한 장을 써놓고 집을 나간다. 이를 안 돼지들은 걱정이 태산이다.,,
1828,,신세계와 함께하는 2022 예술의전당 토요콘서트(8월),클래식 ,"‘예술 같은' 토요일 아침 예술의전당 <토요콘서트>는 바쁜 일상에 지쳐 평소 음악회를 찾기 힘든 직장인과 모처럼의 여유를 즐기려는 연인, 가족들도 편하게 찾을 수 있는 토요일 오전의 마티네 콘서트입니다. 설레는 주말의 시작, 수준 높은 연주와 친절한 해설로 꾸며지는 정통 클래식 음악이 여러분을 찾아갑니다. 협주곡과 교향곡 전곡으로 만나는 다양한 레퍼토리는 마티네 그 이상의 감동을 선사할 것입니다. 여유로운 토요일 아침, <토요콘서트>와 함께 ‘예술’같은 순간을 만끽하시길 바랍니다.",,
1829,,엘사의 생일파티 - 서산,가족/아동 ,오늘은 기쁜 날. 엘사 언니 생일날. 친구들을 초대해서 축하해 주고 파티를 열어야겠어요! 동화 속 공주님들을 모두 초대해서 친구들과 함께 축하해 주고 파티를 연다면 언니가 정말 좋아하겠죠?,,
1830,,2022 세종솔로이스츠의 힉엣눙크！－The Food of Love 〈한국인의 밥상〉,클래식 ,"클래식의 현재와 미래가 여기에. 1994년에 창단한 이래 끊임없는 찬사를 받으며 대한민국을 넘어 세계적인 현악 오케스트라로 자리매김한 세종솔로이스츠. 2017년부터 세종솔로이스츠가 야심 차게 선보인 ‘힉엣눙크! 페스티벌’이 올해 2022년에도 어김없이 찾아왔습니다. ‘여기 그리고 지금’이라는 라틴어에서 이름을 가지고 온 ‘힉엣눙크! 페스티벌’은 그 의미에 걸맞은 참신하고 혁신적인 프로그램으로 대체 불가능한 명성을 쌓아왔습니다. 오는 8월 16일부터 9월 6일까지 이어질 이번 ‘2022 힉엣눙크! 페스티벌’은 그래미 노미네이션에 빛나는 바이올리니스트 필립 퀸트와 뉴욕 필하모닉의 악장 프랭크 황,...",,
1831,,2022 서울시향 베조드 압두라이모프의 베토벤 피아노 협주곡 3번,클래식 ,이날 서울시향 정기공연은 유럽을 뒤흔들고 있는 두 명의 우즈베키스탄 신예들이 꾸민다. 서울시향 데뷔무대를 갖는 지휘자 아지즈 쇼하키모프는 무려 18세라는 젊은 나이에 우즈베키스탄 국립교향악단 상임지휘자로 임명된 뒤 6년 동안 이 악단을 놀라운 수준으로 향상시켜 21세기 음악계 신화를 새로 추가한 인물이다. 그의 재능은 21세이던 2010년 독일 구스타프 말러 지휘 콩쿠르에서 2위에 입상하며 서방세계에도 본격적으로 알려졌으며 2016년 잘츠부르크 ‘젊은 지휘자상’을 수상하며 입지를 확고히 했다. 2021/22 시즌부터 마르코 레토냐로부터 스트라스부르 필하모닉 음악감독직을 물려받았으며 다음 시...,,
1832,,안드로메다 - 대전,클래식 ,"잃어버린 음악을 찾아 떠나는 여정, 아트팝 오페라 [안드로메다]가 새로운 모습으로 관객을 맞는다. 대전의 대표 공연을 목표로 제작한 아트팝 오페라 [안드로메다]는 2020년 갈라 콘서트와 2021년 전막 공연을 통해 객석으로부터 대중성을 인정받았다. 2022년의 [안드로메다]는 그동안 수렴한 평단과 관객의 의견을 반영해, 대본과 음악, 무대를 수정 보완하고 재미와 감동을 더해 더욱 알찬 모습으로 무대에 오를 예정이다. 서사구조는 단순하고 탄탄하게, 무대는 화려하고 속도감 있게, 주인공의 독보적인 아리아를 추가하고, 전체적인 음악은 간결하게 구성해 이미 관람한 관객들도 새로운 작품을 감상하는 느낌...",,
1833,,2022 썸머뉴아티스트콘서트 [첼리스트 원민지] - 대전,클래식 ,썸머뉴아티스트콘서트(SNAC)는 우리 지역 출신의 젊은 음악인들을 위한 무대이다. 대전을 근거지로 활동하고 있는 신진 연주자 발굴 프로그램으로 뛰어난 역량을 지닌 차세대 연주자들이 자신만의 음악 색깔을 나타낼 수 있는 기회를 제공한다. 오디션을 통해 그동안 숨겨진 인재를 선발하여 8월 27일 ~ 28일 이틀간 갈고 닦아온 기량을 선보인다. 대전 음악계를 이끌어갈 차세대 연주자들의 재능과 열정을 함께 느껴보시길. ,,
1834,,2022 썸머뉴아티스트콘서트 [피아니스트 김수빈] - 대전,클래식 ,썸머뉴아티스트콘서트(SNAC)는 우리 지역 출신의 젊은 음악인들을 위한 무대이다. 대전을 근거지로 활동하고 있는 신진 연주자 발굴 프로그램으로 뛰어난 역량을 지닌 차세대 연주자들이 자신만의 음악 색깔을 나타낼 수 있는 기회를 제공한다. 오디션을 통해 그동안 숨겨진 인재를 선발하여 8월 27일 ~ 28일 이틀간 갈고 닦아온 기량을 선보인다. 대전 음악계를 이끌어갈 차세대 연주자들의 재능과 열정을 함께 느껴보시길. ,,
1835,,앤서니브라운의 돼지책 - 대전,가족/아동 ,집안일은 엄마만 한다?! 아주 중요한 회사에 다니는 피곳씨와 아주 중요한 학교에 다니는 사이먼과 패트릭은 집안에서 아무 일도 하지 않습니다. 왜냐하면 집안일은 엄마가 하는 거니까요. 피곳 부인 역시 직장에 나가지만 가족들에게는 별로 중요하지 않습니다.,,
1836,,엘사의 생일파티 - 대구,가족/아동 ,오늘은 기쁜 날. 엘사 언니 생일날. 친구들을 초대해서 축하해 주고 파티를 열어야겠어요! 동화 속 공주님들을 모두 초대해서 친구들과 함께 축하해 주고 파티를 연다면 언니가 정말 좋아하겠죠?,,
1837,,목 짧은 기린 지피 - 청주,가족/아동 ,안녕하세요. 여기는 아프리카의 초원입니다. 저는 초원의 모든 소식을 모두 모두 알고 있는 아프리카의 소식통 치카치카 치카에요~,,
1838,,2022 썸머뉴아티스트콘서트 [첼리스트 장예은] - 대전,클래식 ,썸머뉴아티스트콘서트(SNAC)는 우리 지역 출신의 젊은 음악인들을 위한 무대이다. 대전을 근거지로 활동하고 있는 신진 연주자 발굴 프로그램으로 뛰어난 역량을 지닌 차세대 연주자들이 자신만의 음악 색깔을 나타낼 수 있는 기회를 제공한다. 오디션을 통해 그동안 숨겨진 인재를 선발하여 8월 27일 ~ 28일 이틀간 갈고 닦아온 기량을 선보인다. 대전 음악계를 이끌어갈 차세대 연주자들의 재능과 열정을 함께 느껴보시길. ,,
1839,,김영욱 손정범 듀오 리사이틀 3,클래식 ,"2021년, 4년 만에 선보였던 바이올리니스트 김영욱의 <슈베르트> 무대는 그의 깊어진 음악세계를 관객들에게 선보였던 자리였다. 젊은 거장 바이올리니스트 김영욱이 이번에는 베토벤 바이올린 소나타 전곡 시리즈를 선보인다. 이번 시리즈는 독일 레퍼토리에 정통한 피아니스트 손정범이 함께한다. 총 10곡의 베토벤 바이올린 소나타는 각기 뚜렷한 개성을 드러내며 베토벤만의 뛰어난 독창성을 보여준다. 베토벤의 바이올린 소나타에서는 각 시기별로 그의 음악 양식의 변화를 엿볼 수 있다. 모차르트의 영향이 강하게 드러나는 초기의 소나타들과, 그의 활력 넘치는 개성이 잘 드러나는 중기의 소나타, 그리고 낭만...",,
1840,,문화가 있는 날 Ⅱ 인형극 ［하얀산］- 대전,가족/아동 ,“이 풍진 세상을 만났으니 너의 희망이 무엇이냐?” - 노래 “희망가” 중 어느 날 엉덩이가 붙어서 태어난 소년과 소녀 술과 노름을 좋아하는 엄니와 아부지 쌍둥이를 노리는 곡마단 단장 도망치고 싶은 풍진 세상에서 역경을 딛고 성장하는 소년과 소녀의 이야기 <하얀산>은 인형극적인 요소는 극대화 하고 심도 있는 스토리와 구성을 통해 다양한 연령층이 즐길 수 있는 인형극으로 창작되었습니다. 불우한 환경과 역경을 딛고 내적 성장을 이루어 나가는 인형극 속의 인물들을 통해 어려운 시간을 보내고 있는 동시대의 사람들에게 위로와 공감을 전합니다. ,,
1841,,레이 첸 & 선우예권,클래식 ,"21세기 클래식 뮤지션의 역할을 재정립한 바이올리니스트 레이 첸은 소셜미디어를 통해 관객과 소통하는 선두적인 아티스트로 동시대의 관객들에게 공감을 불러일으키며 즉각적인 반응을 얻는다. 그의 놀라운 음악성은 다양한 매체를 통해 관객들에게 전달되고 있으며, 이는 그가 전 세계 최고의 오케스트라와 저명한 콘서트 홀에서 공연을 하는데 지대한 영향을 미치고 있다. 그는 2008년 예후디 메뉴인 콩쿠르 우승, 2009년 퀸 엘리자베스 콩쿠르 우승과 함께 세계 무대에서 주목받기 시작하였으며 그의 출생지인 호주를 비롯해 유럽, 아시아, 미대륙에서의 공연과 다양한 음반 발매를 통해 명성을 더하고 있다. ...",,
1842,,싱크넥스트22 무용 `디어 누산타라 Dear Nusantara`,클래식 ,"Sync Next 22에서 처음 공개되는 안은미컴퍼니의 신작. 아시아를 배경으로 다양한 프로젝트를 추진해온 안은미컴퍼니가 우리나라와 인도네시아의 밀레니얼 무용수들의 몸짓을 통해 아시아 춤의 세계를 탐색한다. 이 작품을 통해 아시아의 문화와 춤에 대해 고찰하고, 현대무용의 아시아 네트워크를 구축하며 한국이 주도하는 현대무용의 새로운 흐름을 만들어가기를 희망해본다.",,
1843,,리사이틀 ＆ 앙상블 시리즈 Ⅳ ［레이 첸 ＆ 선우예권］- 대전,클래식 ,"다양한 매체를 통한 대중들과의 활발한 소통으로 21세기 클래식 분야에 새로운 바람을 일으키고 있는 바이올리니스트 레이 첸과 뛰어난 연주실력과 품격있는 무대매너로 폭넓은 팬을 확보한 피아니스트 선우예권이 듀오 무대를 선보인다. 두 아티스트는 이미 커티스 재학시절에 함께 호흡을 맞춘 바 있으며, 이후 각자의 연주로 국내외 팬들에게 다양한 무대를 선보여 왔다. 2008년 예후디 메뉴인 콩쿠르, 2009년 퀸 엘리자베스 콩쿠르에서 연달아 우승을 차지하며 국제무대에 화려하게 등장한 레이 첸은 전설적인 바이올리니스트 요셉 요하임이 소장하였던 악기인 1715년 스트라디바리우스 ‘요하임’으로 연주 활동...",,
1844,,앙상블오푸스 제20회 정기연주회 ＂아르토 노라스와 친구들＂,클래식 ,"시간이 흘러도 변하지 않는 것들이 있다. 역병과 전쟁이 그러하다. 인간과 인간성을 파괴하는 사건들은 21세기에도 되풀이되고 있다. 그러나 다른 한편에서는 생명과 존엄성을 지키려는 분투가 계속된다. 공감과 연대를 기반으로 하는 이 공동체는 약한 고리들을 단단하게 연결한다. 존경과 신뢰로 이어진 우정은 쉽사리 그 결속을 끊을 수 없다. 시간이 흐를수록 의미와 울림이 풍성해진다. “아르토 노라스와 친구들”은 음악으로 맺어진 공동체다. 작품과 함께 이야기를 엮어가며 새로운 역사를 써나간다. 2년 전 타계한 펜데레츠키, 우리와 함께 호흡하고 있는 류재준, 오래전 세상을 떠난 브람스까지 이들이 연주하는 ...",,
1845,,2022 서울시향 실내악 시리즈 V,클래식 ,"관악 연주자들로만 구성된 보기 드문 실내악 무대이다. 첫 곡으로 연주되는 스트라빈스키의 관악기를 위한 8중주는 훗날 작곡가의 음악 양식을 대표하는 ‘신고전주의’를 공식적으로 선언한 작품이다. 플루트, 클라리넷, 파곳(2), 트럼펫(2), 트롬본(2) 등 목관 악기와 금관 악기가 다채롭게 편성되어 미니어처 관악 오케스트라의 효과를 기대할 수 있다. 에릭 이웨이즌은 뉴욕을 중심으로 활동하고 있는 동시대 미국 작곡가로, 뉴욕 필의 렉처 콘서트 ‘음악적 조우 시리즈’에서 강사로 인기를 얻고 있는 교육자이기도 하다. 특히 트럼펫과 트롬본, 호른 등 금관악기를 내세우는 신곡들을 다수 발표하며 주목을 받고 있다. ‘...",,
1846,,2022 아침을 여는 클래식 9월 ［피아니스트 김태형&김규연］- 대전,클래식 ,국내외 유수 콩쿠르를 휩쓴 두 명의 피아니스트 김태형과 김규연이다. 타고난 음악적 균형감과 논리정연한 해석을 보여주고 있는 김태형은 2004년 제21회 포르투 국제 피아노 콩쿠르에서 한국인 최초 1위와 베토벤 특별상을 수상하며 국제 음악계에 이름을 알렸다. 섬세한 터치로 서정적인 예술성을 보여주고 있는 김규연은 2006년 더블린 국제 콩쿠르 준우승 및 최고의 협연자상과 모차르트 연주상을 동시에 수상하며 단숨에 음악계의 기대주로 떠올랐다. 이들이 전할 편지는 ‘브람스’로 두 피아니스트의 환상적인 앙상블을 직접 감상해보자.,,
1847,,"［잠들기 전, 심야극장Ⅱ］ 김정원x존노 - 대전",클래식 ,"ON·OFF로 만나는 밤의 음악 코로나19 대응 프로젝트로 2021년 시작한 온라인 콘텐츠 [잠들기 전 심야극장]. 개관 이후 처음 시도한 심야공연은 관객과 활발히 소통하는 연주자 구성으로 폭발적인 관심과 호응을 얻으며 비대면 시대 새로운 공연 컨셉으로 부상했다. 올해는 피아노계 원조 아이돌 피아니스트 김정원이 진행과 연주의 중심을 맡고 젊은 연주자들이 그와 호흡을 맞춰 감미로운 밤의 음악을 들려준다. 심야의 공연장에서 뿐만 아니라 유튜브, 네이버 TV를 통해서도 만날 수 있는 [잠들기 전 심야극장]은 여러분의 귓가에 소곤소곤 마음 따뜻해질 이야기와 음악을 선사한다. 새롭고 아름다운 경험이 될 잠...",,
1848,,2022 서울시향 실내악 시리즈 VI,클래식 ,서울시향 하반기 시즌의 두 번째 실내악 공연의 테마는 ‘크로이처’이다. 이날 프로그램 중 가장 먼저 작곡된 베토벤의 ‘크로이처’는 그가 작곡한 아홉 번째 바이올린 소나타로 가장 화려하고 강렬하며 진지한 무게를 과시한다. 하지한 ‘크로이처’란 제목은 의외의 반전 에피소드를 품고 있다. 베토벤은 이 곡을 영국의 아프로큐반 혼혈 바이올리니스트 조지 브리지타워와 함께 초연했다. 하지만 그가 자신의 여자 친구를 비난하자 베토벤은 마음이 상한 나머지 그와 절교하고 이 곡을 생면부지의 프랑스 바이올리니스트 로돌프 크로이처에게 뜬금없이 헌정했다. 정작 크로이처는 이 소나타를 “난폭하고 이해불가능”하다는 ...,,
1849,,책 먹는 여우 - 용인,가족/아동 ,여우는 책을 먹을 때 언제나 소금과 후추를 뿌려서 먹는데요~ 왜 그럴까요? 공연을 보시면 정답을 알 수 있어요!!,,
1850,,2022 여민락 콘서트 <시리즈2> - 4회 뮤지컬배우 차지연 - 세종,콘서트 ,"올해로 6년차를 맞이하는 <여민락 콘서트>는 수준 높은 연주와 해설이 곁들어져 쉽고 편안하게 즐길 수 있는 마티네콘서트이다. 2022 시즌은 클래식·뮤지컬·재즈 장르 총 3개의 시리즈로 7회 공연이 진행된다. 시리즈1은 피아니스트 김정원과 함께 '천천히 가는 시간'이라는 주제로 한번 쯤 들어본 듯한 슈베르트, 슈만, 브람스 등 클래식 거장들의 곡을 매회 게스트를 초청해 다채롭게 진행된다. 시리즈2는 뮤지컬 배우 차지연이 유명 뮤지컬 넘버를 해설과 함께 선보이는 갈라 공연으로, 마지막 시리즈3은 재즈보컬리스트 말로가 친숙한 재즈음악뿐만아니라 명곡을 재즈로 편곡해 다양한 편성으로 들려줄 예정이다. ...",,
