,Unnamed: 0,title,sub_title,intro,link_url,image_url
564,564.0,부천시립합창단 제160회 정기연주회 - 독일 레퀴엠 - 부천,클래식 ,"6월은 떠난 이를 기리고 남은 자를 위로하는 브람스 레퀴엠을 두 대의 피아노 버전으로 연주한다. ‘독일 레퀴엠’으로 일컬어지는 이 작품은 이전 종교음악과 달리 미사를 위해 작곡된 것이 아닌, 유족을 위한 음악회용으로 지어졌기 때문에 그저 엄숙하지만은 않다는 점이 특징이다. 장송곡이지만 궁극적으로는 희망을 노래하고 있으며, 곳곳에 묻어나는 친밀한 음색은 우리의 아픈 역사를 돌아보고 보듬기에 충분할 것이다. ",,
565,565.0,싱크넥스트22 오플레이 `파우스트: 악마의 속삭임`,클래식 ,"서울시오페라단이 걸작 '파우스트'를 연극과 오페라를 콜라주한 새로운 공연 형식 '오플레이'로 재탄생시킨다. 오페라 장르의 한계를 넘어, 독일 대문호 괴테의 문학과 프랑스 낭만 음악의 진수를 선보인 작곡가 구노 음악의 매력을 유감없이 보여줄 예정이다. 출연진은 객석과 무대를 넘나들며 인간의 끝없는 욕망에 대해 질문한다. 성악계의 숨겨진 보석 같은 신진 성악가들의 에너지 넘치는 연기와 음악, 그리고 속도감 있는 전개가 관객을 무대 속으로 이끈다. 연기자 정찬도 무대에 함께하여 파우스트의 중년 모습을 연기할 예정이다.",,
566,566.0,월곡 - 대구,뮤지컬 ,"역병과 기근으로 부모를 잃은 월이와 그런 그녀를 친동생처럼 여기는 혁이는 주인의 악독한 행포와 비참한 노비 생활에 환멸을 느끼고 도망친다. 이 상황을 지켜본 우배선은 이들을 가엾이 여겨 집으로 데리고 온다. 정 많은 식구들과 함께 생활하며 평온한 날들을 지내고 있는 월이는 자신도 모르는 사이 우배선을 동경하게 되고, 혁이는 우배선을 향한 월이의 모습을 지켜보며 복잡한 감정을 느낀다. 한편 도요토미 히데요시가 정명가도를 내세워 조선을 침략하고, 스물네 살의 청년 우배선은 우리 고향, 우리 가족을 지켜내고자 50여 명의 의병들을 꾸려 1592년 4월 벚꽃이 만개한 비슬산에서 “왜군 토벌”이라는 결...",,
567,567.0,모든 날 모든 순간 - 광주,연극 ,"원철과 보영은 친구처럼 편하고 알콩달콩 지내는 평범한 결혼 6년 차 된 부부다. 이 부부의 고민은 아직 사랑스러운 아이가 없다는 점인데, 그래서 그들은 독실한 기독교 신자도 믿는다는 용한 삼신할머니에게 점괘도 보고 매번 노력하지만 결과는 늘 실패다. 그런데 어느 날...",,
568,568.0,내 죽음을 기억하시나요,연극 ,다큐멘터리 감독 현수는 선배의 기획 아이템의 펑크로 갑작스럽게 편성을 떠맡게 된다. 이슈를 찾아보던 중 르완다 대학살 25주년의 정보를 얻게 되고 그 역사적 회복 과정에 흥미로움을 느낀다.,,
569,569.0,2022 이범진 피아노 리사이틀 - 대전,클래식 ,"정통 클래식 애호가를 위한 피아노 선율을 무대에 올리고자 한다. 2022년 6월, 리사이틀을 마련하는 피아니스트 이범진은 솔로와 실내악 연주에 탁월한 표현력과 심도 있는 테크닉을 바탕으로 다양한 스타일을 구사하는 연주자로, 음악에 대한 깊이 있고 진지한 해석으로 관객을 매료시키며 전문 연주홀 <까마하우스>에서 하우스콘서트를 꾸준히 개최해오고 있는 대전을 대표하는 피아니스트이다. 이번 독주회는 멘델스존, 베토벤, 리스트, 프로코피예프, 정동희 등 주옥같은 작품들과 함께 관객과 소통할 예정이다.",,
570,570.0,고도 - 진주,연극 ,"불안정한 시대, 무엇이 필요할까? 우울하고 암울한 전쟁 속, 그럼에도 불구하고 우리는 희망을 잃지 않고 살아갈 수 있는 까닭을 찾기 위해 노력한다.",,
571,571.0,월간운석발굴모임,연극 ,"토리와 지은은 이야기를 쓰고 싶다. 사람들이 기억할 수 있는 진짜 우리의 이야기. 그래서 우주에서 떨어진 돌, 운석을 찾아 떠나기로 한다.",,
572,572.0,"점과 점을, 잇는 선. 으로 이루어진, 육면체. 그 안에, 가득 차 있는, 몇 개나 되는, 서로 다른 세계. 그리",연극 ,"2001년. 같은 동네에서 자라 같은 학교를 다니는 여섯 명의 중3 무리가 있다. 매일 학교와 집을 오가며 이렇다 할 사건 없이 지내던 중, 무리 중 한명인 '아야'가 가출을 감행한다.",,
573,573.0,KCO와 랄프 고토니의 모차르트 교향곡 46 전곡 시리즈 5,클래식 ,"천상의 영롱한 선율, 어린 아이와 같은 유쾌함, 천진난만함과 순수함이 ‘마치 천사의 목소리’ 같은 아름다움을 전하는 모차르트 음악은 기쁨과 슬픔을 동시에 느끼게 하는 묘한 매력을 지녔다. 그래서 그런지 연주자들과 청중들은 미소년 같은 모차르트 선율의 저 편에서 흐르는 알 수 없는 그리움의 실체를 탐험하며 사랑하게 되고 매혹에 빠진다. 음악학자들은 그를 ‘불규칙성의 천재’라고 말한다. 마음을 활짝 열게 하는 그의 음악은 다양한 변화가 주는 재미 뿐 아니라 새로운 아이디어로 반짝거렸다. 복잡하면서도 단순하고 깨질 것 같으면서도 단단한, 통일과 대조의 미학이 아름다운 세계. 모차르트 음악에는 자유로...",,
574,574.0,국립오페라단 〈라 트라비아타〉 - 세종,클래식 ,"베르디는 <라 트라비아타>는 사교계의 여성, 비올레타와 그녀의 연인 알프레도의 비극적인 사랑을 담은 오페라로 세계 오페라 무대에서 가장 인기있는 작품이다. 국립오페라단의 <라트라비아타>(2014년 초연, 아흐노 베흐나흐 연출)는 초연 이후 많은 관객들의 사랑을 받았다. 19세기로 시대적 배경을 설정하였고, 사회 현실에 대한 비판과 더불어 인간의 본질을 고민한 베르디의 의도를 녹여내며 극적이면서도 우아하고 세련된 무대를 선보일 예정이다. ",,
575,575.0,목수장이 엘리 - 부천,가족/아동 ,서로에게 별표와 똥표를 붙이는 나무사람들의 세계에서 포포는 반짝이는 별표가 너무 갖고 싶었어요. 그래서 높은 산을 오르고 깊은 바다를 건너 모르는 게 없는 마법사 수리수리를 찾아가기로 했지요.,,
576,576.0,국립무용단 〈회오리〉,클래식 ,"국립무용단 역사상 처음으로 해외 안무가를 초빙해 만든 <회오리>는 한국춤에서 파생된 이국적이면서도 깊이 있는 움직임을 보여주었다. 국립무용단이기에 가능했던 독보적 역량으로 호평 받은 이 작품은 2015년 프랑스 칸 댄스 페스티벌 개막작으로 초청되는가 하면 일본 요코하마 가나가와예술극장 공연 등 수차례의 국내외 공연을 통해 국립무용단의 인기 레퍼토리로 자리매김했다. 핀란드 출신 천재 안무가 테로 사리넨이 탄생시킨 역동적인 한국춤에, 안무를 시청각적으로 완성해주는 미키 쿤투의 간결한 무대와 조명, 에리카 투루넨의 모노톤 의상, 작곡가 장영규가 이끄는 비빙의 라이브 음악은 잔잔한 물결...",,
577,577.0,어린왕자와 함께 그리는 명작 클래식 콘서트 [피아니스트 김현정 글로리아],클래식 ,"파워풀하면서도 섬세한 아름다운 음색을 지닌 피아니스트 김현정 글로리아는 탁월한 연주로 청중을 압도하며 폭넓은 레퍼토리를 바탕으로 비루투오소적 기교를 지녀 극찬을 받고있다. 선화예술고등학교 및 이화여자대학교 음악대학을 졸업한 후 이화여대대학원을 졸업(수석입학)하고, 미국 Indiana University 석사(M.M)과정 및 최고연주자과정(P.D)을 졸업하였다. 귀국 후 대구카톨릭대 음악 미학 박사과정을 수료하였다. 선화예술학교콩쿠르에서 2위를 하여 선화예술학교 시험 면제로 입학허가를 받았으며, 선화예술고등학교 재학 당시에는 실기 및 학과 장학생으로 선발되기도 하였다. 또한 Indiana University에서도 장학금을 수여받으며 뛰어난 학업 성취도를 인정받은 바 있다. ",,
578,578.0,KT와 함께하는 예술의전당 마음을 담은 클래식,클래식 ,2021년 2월부터 매월 넷째 주 금요일 오전을 음악으로 채워주고 있는 예술의전당 마티네 콘서트 이 2022년 두 번째 시즌을 맞이하였습니다. 국내에서 활발히 활동 중인 중견 연주자를 중심으로 지휘자 이택주가 이끄는 KT심포니오케스트라가 깊이 있고 풍성한 연주를 선보입니다. 또한 2004년 예술의전당 사장으로 재직 시절 마티네 콘서트를 론칭해 전국에 마티네 콘서트 열풍을 일으킨 피아니스트 김용배가 콘서트 가이드로 나서 쉽고 재미있는 해설을 곁들여 초심자와 애호가 모두 만족하는 음악회로 꾸밉니다.,,
579,579.0,＃나만빼고 - 대전,연극 ,"고백 한 번 해보지 못하고 나 홀로 이별여행을 준비하는 찌질한 청년 진욱. 목적지 없이 터미널에 도착해서 제일 먼저 출발하는 대부도행 버스 티켓을 끊는다. 대부도 여행 도중에 만나게 되는 주말부부 남편, 게스트하우스에서 만나는 독특하고 재미있는 상황과 사람들, 아침에 식당에서 만나는 가족 이야기... 이 사람들을 만나고 용기를 얻은 진욱은 서울에 도착해서 고백을 준비하는데...",,
580,580.0,인비저블 - 대구,뮤지컬 ,"<나니아 연대기>의 루이스, <반지의 제왕>의 톨킨 판타지를 둘러싼 그들의 이야기. 1963년 11월. 노인이 된 톨킨이 홀로 서재에 앉아있다. 잠시 뒤, 젊은 학자가 톨킨을 찾아와 루이스의 부고 소식을 전하며, 장례식 추모사를 부탁한다. 하지만 톨킨은 오래된 친구였던 루이스의 추모사는 물론이고 장례식에도 참석하지 않겠다며 단호하게 거절하는데… 30년 전, 제1차 세계대전을 겪고 모두가 아픔을 안고 살아가던 시대. 이야기의 힘을 믿고 함께 판타지를 만들자고 했던 두 사람에게 무슨 일이 있었던 걸까.",,
581,581.0,산들 - 대구,뮤지컬 ,"가까운 미래, 전쟁의 위협이 상존해 있는 한국 동부전선의 러키세븐 부대 군견병 김병장과 그가 핸들러를 맡은 저먼 쉐퍼드 ‘산들’은 전방 동부전선 러키세븐 부대에서 함께 지내고 있다. 김병장은 일병때 그가 신참때부터 함께 했던 ‘별’이가 훈련 중 심각한 부상으로 재활을 받던 중 회복하지 못해 자기 손으로 안락사를 시킨 경험이 있다. 김병장은 후임으로 들어온 이상병에게 산들을 인수인계하고 제대 후 산들이 복무해제 되면 민간입양을 계획중이다. 여군 선임조교이자 강직한 군인인 강하사는 영내 군기반장으로 제대를 앞둔 김병장과 티격태격하며 가끔 냉기류를 형성하지만 군견 양키를 떠나보낸 경험이 있다. ...",,
582,582.0,열차는 밀라노를 막 지나쳤다 - 부산,뮤지컬 ,"탈북자 혜령과 트랜스젠더 정석은 유럽행 고속 열차 안, 같은 칸에 앉게 된다. 우연한 계기로 통성명을 하게 된 둘은 서로 친밀해져 솔직한 이야기를 나눈다. 안개구간에서 열차가 멈춰 서자, 둘은 잠시 열차 밖으로 나간다.",,
583,583.0,스페셜 5 - 대구,연극 ,"이 작품에 등장하는 모든 인물은 특수한 능력을 가지고 있습니다. 하지만 하늘을 날 수는 있지만 단 30 초만 날 수 있는 사람, 텔레파시를 보낼 수는 있지만 받지는 못하거나, 노래로 텔레파시를 보낼 수 있지만 음치인 사람, 잃어버린 열쇠가 어디에 있는지 알 수 있는 살마 등등 무언가 하나 부족해 보이는 초능력을 가진 사람들로만 이루어져 있습니다. 이런 “특별한” 세상에, 어느 날 한 아이가 태어납니다. 이 작품의 주인공 제이크는 아무런 능력이 없이 태어났고 이로 인해 그가 태어나자마자 온 세상은 발칵 뒤집힙니다. 가장 보통의 아이가 가장 특별하고 별난 아이가 되는 이 작품 속의 세계에서 제이크의 탄생은 ...",,
584,584.0,송동건 귀국 색소폰 독주회,클래식 ,"세련된 감각과 풍부한 음악성으로 청중의 마음을 사로잡는 색소포니스트 송동건은 대전예술고등학교를 거쳐 한국예술종합학교 예술사(학사)를 우수한 성적으로 졸업 후 프랑스로 건너가 부르그-라-헨느 시립음악원(CRD de Bourg-La-Reine/Sceaux)에서 D.E.M과정(전문연주자과정) 색소폰 전공 디플롬을 졸업하였고 세르지-퐁투아즈 시립음악원(CRR de Cergy-Pontoise)에서 Classe de Maître과정(최고연주자과정) 색소폰 전공 디플롬을 졸업하며 전문연주자로서의 탄탄한 기반을 마련하였다. 어려서부터 재능이 남달랐던 그는 제8회 서울대학교 음악대학 관악동문회 콩쿠르 2위, 제17...",,
585,585.0,2022 에듀스아트 특별기획 - 대전,클래식 ,"""위대한 클래식 작품 속 아름다운 2악장을 무대에 올리는 특별한 음악선물"" 에듀스아트는 2016년 12월, 민간 비영리 국제음악교류 및 전문 클래식 음악의 예술창작활동 증진과 학구적 음악연구를 위하여 설립되었다. 이번 2022년 에듀스아트 특별기획 공연은 “세컨드 무브먼트(Second Movement)”란 부제로 위대한 작곡가들의 2악장만을 발췌하여 연주하는 특별한 무대이다. ""에듀스 아트""는 2016년 12월, 민간 비영리 국제음악교류 및 전문 클래식 음악의 예술창작활동 증진과 학구적 음악연구를 위하여 설립되었다. 이번 정기연주회는 세컨드 무브먼트(Second Movement)란 부제로 감성적이고 낭...",,
586,586.0,보물섬 - 인천,가족/아동 ,바닷가 선창가에서 주점을 하시는 어머니를 도우며 살아가는 짐은 자상하신 리브지 선생님에게 공부를 배우고 있는 모험심이 강하고 명랑한 소년이다. 어느 날 해적의 일원이었던 빌 아저씨가 주점을 찾아와 숨을 거두면서 짐과 리브지 선생님에게 불쌍하고 어려운 사람들을 도울 것을 부탁하며 보물 지도를 넘겨준다. 평소 바다를 항해하는 게 꿈이었던 짐은 드디어 존경하는 리브지 선생님과 신나는 모험을 떠나게 되는데...,,
587,587.0,보이야르의 노래,가족/아동 ,"망고나무 '고고'와 함께 평화로운 날을 보내던 소녀 '리아' 어느 날 갑자기 친구들과 함께 놀던 곳들이 전부 사라지고, '고고'도 베어져 버린다.",,
588,588.0,베이비드라마 '소리나무' - 진주,연극 ,아기들을 위한 청각과 촉각을 더한 예술체험! 사람은 뱃속부터 청각이 먼저 발달한다고 하죠?,,
589,589.0,그녀가 산다 - 대구,연극 ,"월급은 박봉, 밀리는 월세, 결혼의 압박... 시대의 청년들이 하는 똑같은 고민을 하며 살아가는 평범한 단심은 외롭다. 그런 어느 날 단심이를 구제해 줄 남자가 등장한다.",,
590,590.0,2022 관현악시리즈 〈전통과 실험-동해안〉,클래식 ,"o 2022년 '명연주자 시리즈'와 함께 새롭게 선보이는 '관현악 시리즈' o 관현악 시리즈 '전통과 실험' 매년 다양한 전통예술 중 하나의 주제를 설정하고, 위촉된 작곡가가 해당 주제를 연구하여 새롭게 창작한 작품을 발표하는 연주회 o '전통과 실험' 첫 번째 이야기 – 동해안 2022년 관현악 시리즈 '전통과 실험' 공연의 문을 여는 테마로 ‘동해안 별신굿’을 주제로 선정, 위촉 작곡가들이 각자 연구하고 상상한 내용으로 작곡함으로써 새로운 음악적 경험을 할 수 있는 연주회로 구성 o 20대부터 50대까지 폭넓은 연령대의 작곡가들이 각자의 시선으로 그려내는 '동해안 별신굿' 주제의 국악관현악 작품을 감상하는 무대",,
591,591.0,앤서니브라운의 돼지책 - 서울,가족/아동 ,집안일은 엄마만 한다?! 아주 중요한 회사에 다니는 피곳씨와 아주 중요한 학교에 다니는 사이먼과 패트릭은 집안에서 아무 일도 하지 않습니다. 왜냐하면 집안일은 엄마가 하는 거니까요. 피곳 부인 역시 직장에 나가지만 가족들에게는 별로 중요하지 않습니다.,,
592,592.0,캐치！티니핑 〈프린세스 다이어리〉 - 전주,가족/아동 ,"하모니 마을의 발전을 위해 누구나 공주가 될 수 있는 ""하트 프린세스 페스티벌"" 축제를 기획한다. 이 소식을 들은 로미의 절친 마야, 메리루가 로미를 찾아와 하트 프린세스 페스티벌에 나가자고 제안을 한다. 하트로즈 삼인방 오빠들까지 하모니 마을의 프린세스는 로미 뿐이라고 띄어주는 바람에 등 떠밀리듯 프린세스 페스티벌 참가를 결정하는 로미.",,
593,593.0,알라딘과 자스민공주 - 화성,가족/아동 ,"무대는 사막의 아라비아 왕국을 배경으로 펼쳐지고 주인공 알라딘이 모험심 많은 용감한 소년으로 등장한다. 술탄의 아름다운 딸 ""자스민 공주"" 또한 모험심에 가득 찬 여성으로 등장하며 마법사 ""자파""가 탐욕과 계략으로 알라딘과 공주를 괴롭히며 아주 코믹한 인물로 등장한다.",,
594,594.0,인어공주 - 대전,가족/아동 ,바다 왕국을 지배하는 라이톤 대왕에게는 7명의 딸이 있다. 그 중 막내딸인 에리얼은 언제나 바다 위 인간들의 세상에 나가 길 원한다. 어느 날 폭풍으로 인해 인간 세상의 에릭 왕자가 바다에 빠지고 에리얼이 왕자를 구한다.,,
595,595.0,인어공주 - 울산,가족/아동 ,바다 왕국을 지배하는 라이톤 대왕에게는 7명의 딸이 있다. 그 중 막내딸인 에리얼은 언제나 바다 위 인간들의 세상에 나가 길 원한다. 어느 날 폭풍으로 인해 인간 세상의 에릭 왕자가 바다에 빠지고 에리얼이 왕자를 구한다.,,
596,596.0,알라딘 - 광주,가족/아동 ,불의를 보면 참지 못하는 착한 마음을 가진 알라딘!! 힘없는 사람들을 돕기 위해 병사에게 쫓기던 중 나쁜 마법사 자파에게서 도망치던 자스민공주와 만나 사랑에 빠지게 된다.,,
597,597.0,알사탕 - 제주,가족/아동 ,"문방구에서 산 알사탕 한 봉지. 사탕 한 알을 입에 넣자, 원래는 들을 수 없던 소리가 들린다! ""동동아~ 동동아~"" 마법의 사탕이 들려주는 마음의 소리! 다음엔 또 누구의 소리가 들릴까?",,
598,598.0,바다탐험대 옥토넛 시즌2 - 용인,가족/아동 ,"아름다운 산호초로 뒤덮인 호주 대산호초에는 다양한 바다 생물들이 함께 모여 살아가고 있다. 옥토넛도 탐험선을 타고 대산호초 탐험을 떠나고, 그곳에서 커다란 산호로 자라나길 꿈꾸는 아기 산호 코리를 만난다. 그런데 이때, 평화를 깨고 배고픈 가시관 불가사리 무리가 몰려 오는데...! 옥토넛과 바다 생물들, 지금 바로 대산호초 보호작전 개시!",,
599,599.0,피터팬 - 김포,가족/아동 ,"피터팬은 네버랜드 나라에서 웬디의 집까지 날아오게 된다. 한편, 영국 런던에서 살고 있던 웬디와 존, 마이클은 자신의 방에서 피터팬의 발자국을 발견한다.",,
600,600.0,캐리와친구들 2022-콘서트를 지켜라! - 부산앵콜,가족/아동 ,"우리만의 특별한 추억을 만들기 위해 캐리와 친구들이 모여 재밌는 콘서트를 시작하려는 순간! 불청객 악당이 나타나 공연장을 엉망으로 만들기 시작하는데 ""괜찮아. 소중한 친구들과 함께라면 우린 지지 않을 거야""",,
601,601.0,국립창극단 〈절창Ⅱ〉,클래식 ,"국립창극단 민은경과 이소연의 ‘힙’하고 ‘딥’한 판소리 “판소리를 소리판보다 더 즐겁게 감상할 수 있는 방식이 태어났다”. <절창>은 판소리의 동시대성을 표현할 참신한 구성과 미장센, 그리고 쉼 없이 판소리를 수련하며 성장하고 있는 MZ세대 젊은 소리꾼들의 진면목에 초점을 맞춘 새로운 형식의 판소리 공연이다. 지난 시즌 첫 공연의 호평을 이어갈 두 번째 무대인 <절창Ⅱ>가 열리는데, 그 주인공은 국립창극단의 대표 여성주자 민은경과 이소연이다. 국립창극단의 대표작마다 출연해 강렬한 존재감으로 무대를 빛내는 창극 배우이자, 동시대 관객과의 소통에도 적극적인 젊은 소리꾼 민은경과 이소연. 출구 없...",,
602,602.0,포텐독：똥 밟았네 - 성남,가족/아동 ,"""똥 밟았네"" 율동과 포텐독 타이틀 속의 메들리가 펼쳐지는 오프닝쇼! 개똥밭이 된 도심 출근길! 사람들은 출근 도중 길 위에 개똥을 밟고 미끄러질 뻔하며 ""똥 밟았네"" 댄스를 춘다.",,
603,603.0,엄마까투리 마트에 간 꽁지 - 안양,가족/아동 ,"""이번엔 마트다!!"" 엄마가 좋아하는 체리를 구경하다 사고로 마트에 간 꺼병이들, 한밤중에 일어나는 마트의 특급 비밀은 과연 무엇일까? '마트에 간 꺼병이 구하기!! 삐약삐약 대작전~!'",,
604,604.0,"유정, 봄을 그리다 - 하남",뮤지컬 ,"1937년, 봄이 채 오지 않은 실레마을. 오랜 일제의 탄압으로 실레마을 사람들의 삶은 점점 참혹해진다.",,
605,605.0,미니특공대 애니멀트론 - 제주,가족/아동 ,애니멀트론 종족에게 봉인되었던 몬스터 에그킹들이 감옥 탈출에 성공하게 되고 자신들만의 행성인 '에그킹 플레닛'을 건설하기 위해 우주에서 가장 아름다운 별인 지구를 정복할 계획을 세운다.,,
606,606.0,치카치카 호랑이 - 의정부,가족/아동 ,"어느 숲속, 배가 무척 고픈 호랑이가 있었습니다. 그곳에 팔도를 여행하며 다니는 나그네 토끼가 등장합니다. 호랑이는 젖 먹던 힘까지 다 짜내 겨우 토끼를 잡는데 성공하지만, 토끼를 먹을 수가 없었어요. 그 이유는 바로, 오래 앓던 충치 때문이었지요!",,
607,607.0,2022 임창정 전국투어콘서트 ＇Multiverse＇ - 안양,콘서트 ,2022 임창정 전국투어 콘서트 ［Multiverse］ 본캐와 부캐를 넘나들며 확장된 세계관을 구축한 창정 유니버스 그동안 베일에 싸여있던 멀티버스가 펼쳐진다.,,
608,608.0,헬로카봇 시즌6 〈흔들흔들 댄스파티〉 - 부천,가족/아동 ,"대국민 댄스 오디션 <댄싱 히어로>가 개최된다구? 오디션에 참가한 차탄과 친구들! ""으아아 떨린다 떨려!"" 하지만 오디션장에 MTS 일당과 어둠의 마법사 블랙 위저드가 나타나 대회는 엉망이 되는데…",,
609,609.0,내가아빠고 아빠가나라면 - 대구,가족/아동 ,"무엇이든 척척 잘해 보이는 아빠와 맨날 놀 것만 같은 민이는 서로 역할을 바꾸어 보기로 해요. 민이는 아빠 대신 회사에 출근하고, 아빠 방도 차지하죠. 하지만 민이가 걱정인 아빠는 온종일 몰래 따라다녀요. 며칠 동안 서로의 역할을 바꾸어 생활하면서 아이는 아빠의 마음을, 아빠는 아이의 마음을 이해할 수 있어요.",,
610,610.0,핑크퐁과 아기상어의 월드투어쇼 - 수원,가족/아동 ,오랜 시간 집에서만 노는 것에 지쳐버린 핑크퐁과 아기상어는 튼튼쌤과 함께 비행기를 타고 전 세계 친구들을 만나러 여행을 떠나기로 했어요! 중국에서 판다 친구를 만나 쿵푸 체조도 배워보고 핀란드 산탄 할아버지의 고향도 가보고 으스스하지만 왠지 모르게 멋진 멕시코 명절부터 쿵작쿵작 신나는 브라질 카니발까지!,,
611,611.0,꼬마버스 타요 - 성남,가족/아동 ,"꼬마 버스 타요의 머리에 새 둥지가 생겼어요. 친구들과 함께 시골 여행을 떠난 타요는 쌩쌩 달리고 싶지만, 새 둥지의 알들이 깨어날 때까지 달릴 수 없대요. 쌩쌩 시골길을 달리는 친구들이 부럽기만 한 타요, 게다가 청천벽력 같은 소식!",,
612,612.0,최현우 'THE BRAIN' - 부산,콘서트 ,"상상 그 이상의 블록버스터급 매직 콘서트! 25주년을 맞은 마술사 최현우의 대표 매직 콘서트! 멘탈 매직 시리즈 최초의 공연 <더 브레인> 3년 만의 컴백 심리 마술부터 대형 일루전, 초대형 스케일 등 화려한 볼거리 2021년의 대미를 장식할 최고의 공연!",,
