,Unnamed: 0,title,sub_title,intro,link_url,image_url
1221,,개와 고양이 - 대구,가족/아동 ,사이가 좋았던 개와 고양이가 으르릉~ 원수가 된 이유는 무엇일까요? 서로 부족한 점을 채워주며 힘을 합하면 무엇이든 할 수 있음을 알려주는 인형극 <개와 고양이> 이야기 속으로 함께 떠나요!,,
1222,,누가 내 머리에 똥쌌어 ? - 서울,가족/아동 ,"두더지에게 정말로 화가 나는 일이 생겼어요. 어느 날, 해가 떴나 안 떴나 궁금해 땅 위로 머리를 내미는 순간 똥 무더기가 머리에 떨어진 거예요.",,
1223,,겨울이야기 시즌2 - 상주,가족/아동 ,"전 시즌의 사건 이후, 다시 안정을 되찾고 평화로움이 가득해진 아렌델 왕국. 그런데 어느 날, 평화롭던 아렌델의 땅이 흔들리고, 물과 불들이 춤을 추자, 아렌델은 큰 혼란에 휩싸이게 된다.",,
1224,,2022 송가인 전국투어 콘서트 - 대구,콘서트 ,트롯 여제 ＇송가인＇ 의 귀환! 오랜 시간 기다려준 팬들을 위헤 그리움과 변함없는 사랑을 담은 진심 어린 콘서트 올 봄을 정통 트로트로 물들일 새 정규앨범 ＇연가＇(戀歌)와 수많은 명곡들이 더해진 무대로 관객 여러분께 더욱 깊고 진한 감동을 선사합니다. 보고 싶었습니다. 그리웠습니다. 그 특별함을 선물할 송가인 의 이야기 속으로 여러분을 초대합니다!,,
1225,,2022 B.N.F Festival,콘서트 ,"빅플래닛메이드엔터에서 선보이는 색다른 야외 콘서트 '2022 Big planet made & Friends Festival' 탁 트인 호수와 푸른 잔디가 펼쳐진 곳에서 빅플래닛메이드가 특별한 6월의 여름을 선물합니다. 새롭게 시작되는 초록의 계절, 빅플래닛메이드 아티스트들의 ‘Friends’가 되어 오직 'B.N.F Festival'에서만 볼 수 있는 특별한 무대들과 함께 새로운 여름을 시작해보세요!",,
1226,,찰리채플린의 잃어버린 지팡이,연극 ,"""인생은 멀리서 보면 희극, 가까이서 보면 비극""",,
1227,,나 홀로 숨바꼭질2,연극 ,강령술 전문 스트리머 하민과 주연은 어쩔 수 없는 이유로 위험하기로 유명한 '나 홀로 숨바꼭질'이라는 강령술을 진행하게 된다. 강령술이 끝난 후 알 수 없는 악몽에 시달리며 귀신이 보이는 하민. 그 이유는 ...,,
1228,,서울대 음악가들이 연주하는 지브리/디즈니OST 콘서트,클래식 ,"서울대 음대 뮤지션들로 구성된 에스파스클래식의 서대문 살롱콘서트에 초대합니다. 바이올린,비올라,피아노 연주자들로 구성된 에스파스클래식은 이미 수차례 매진과 함께 뜨거운 관객들의 호응을 이끌어냈습니다. 이번 콘서트에서는 지브리&디즈니OST로 관객분들을 찾아갑니다. 어린이부터 어른, 남녀노소 할 것 없이 누구나 즐길 수 있는 콘서트이니 많은 관심가져 주세요. 좌석이 많지 않으니 예매는 서두르세요^^",,
1229,,정엽X유채훈 콘서트 ‘Re:feel’ - 대구,콘서트 ,"정엽X유채훈 콘서트 ‘Re:feel’ 다른 장르, 비슷한 취향을 지닌 두 아티스트의 만남! 브라운아이드소울의 ‘정엽’, 그리고 라포엠의 ‘유채훈’. 스티비 원더 등 모타운 음악을 함께 좋아하여 시작된 공연은 시대와 장르를 넘나드는 다채로운 무대로 펼쳐질 예정입니다. 두 아티스트의 새로운 감성으로 채워질 ‘Re:feel’ 그 생생한 현장으로 여러분을 초대합니다.",,
1230,,"유정, 봄을 그리다 - 강릉",뮤지컬 ,"1937년, 봄이 채 오지 않은 실레마을. 오랜 일제의 탄압으로 실레마을 사람들의 삶은 점점 참혹해진다.",,
1231,,피노키오 - 아산,가족/아동 ,어느 마을에 가구를 만들어 생계를 꾸려 나가면서 가족도 없이 혼자 외로이 사는 제페트 라는 노인이 있었습니다. 제페트가 나이가 들수록 그의 외로움은 점점 더해만 갑니다.,,
1232,,밴드발전소 2기 공연,콘서트 ,드디어 대망의 밴드발전소2기 공연이 열립니다! 올해 2월부터 시작된 아마추어 밴드 결성 프로젝트로 만난 학생들은 12회차의 수업을 통해 이제는 하나의 밴드가 되었습니다. 그들의 모습은 6월 4일 복합문화공간에무 팡타개라지에서 보실 수 있습니다.,,
1233,,방울방울 매직버블쇼 - 의정부,가족/아동 ,김해성 마술사와 함께하는 판타스틱 매직 버블쇼~!,,
1234,,[오산 위클리클래식 페스티벌] 리미트리스 클래식 2,클래식 ,"클래식이 클래식일수 있는 이유는, 변하지 않는 아름다움 때문이겠지요. 하지만, 그 견고한 선 안에서도 무한한 자유를 표현하고 싶었습니다. 공간의 벽을 허물고 더 친숙하게 다가가고, 새로운 해석으로 다양한 레퍼토리를 만날 수 있도록 현재 활발하게 활동중인 젊은 아티스트들이 참여하는 Limitless Classic Series 를 선보입니다. 하루 2회의 공연이 시리즈로 진행 되는데요. 첫번째인 Part 1은 가장 위대한 작곡가 '베토벤' 을 피아노와 클라리넷, 그리고 첼로의 특별한 편성으로 만나보겠습니다!",,
1235,,[오산 위클리클래식 페스티벌] 리미트리스 클래식 1,클래식 ,"클래식이 클래식일수 있는 이유는, 변하지 않는 아름다움 때문이겠지요. 하지만, 그 견고한 선 안에서도 무한한 자유를 표현하고 싶었습니다. 공간의 벽을 허물고 더 친숙하게 다가가고, 새로운 해석으로 다양한 레퍼토리를 만날 수 있도록 현재 활발하게 활동중인 젊은 아티스트들이 참여하는 Limitless Classic Series 를 선보입니다. 하루 2회의 공연이 시리즈로 진행 되는데요. 두번째 시간인 Part 2 는 피아노 퀸텟으로 구성되어 고전시대 작곡가 모차르트와 슈베르트의 음악에 푹 빠져봅니다. 바로 내 눈 앞에서 5명의 연주자의 화려하고 아름다운 선율에 푹 빠져보는 시간 되시길 바랍니다.",,
1236,,문화의 향기가 가득한 송도만의 특별한 콘서트 - 인천,콘서트 ,"<2022년 연수구 문화예술 분야 주민참여예산> 제안서 기반으로 기획·추진하는 사업으로 도심 속 자연을 누릴 수 있는 공원에서 아름다운 환경과 다채로운 클래식 공연을 진행합니다. 내 집 앞, 동네 공원에서 품격 있는 공연으로 자연과 음악이 주는 행복과 여유를 일상에서 만끽하시길 바랍니다.",,
1237,,2022 청소년을 위한 교과서 해설 음악회 - 성남,클래식 ,"1996년 청소년들의 정서 함양과 인격 창조, 올바른 청소년 문화 육성을 목적으로 창단한 성남시 최초의 청소년 오케스트라인 성남 청소년 오케스트라가 오늘 6월 22일 성남아트센터에서 '청소년을 위한 교과서 해설 음악회'를 개최합니다. 모짜르트 최후의 3대 교향곡 중 하나라고 불리는 교향곡 40번 전 악장을 시작으로 비에니아프스키 바이올린 협주곡 2번, 요한스트라우스 2세 황제 왈츠, 푸치니 오페라 '라보엠', 와일드혼 뮤지컬 '지킬 앤 하이드' 중 '지금 이순간', 이탈리아 칸초네 나폴리 민요 ' 오 나의 태양' 등 너무나 유명한 다양한 곡들이 연주됩니다. 특히 19세기 바이올린의 명수라 불리는 비에니아프스키의 대표작 바이올린 협주곡 No.2 은 연주가 까다로워 바이올린 기교의 절정을 보여준다고 알려져 있습니다. 이번 연주자인 분당중학교 2학년 홍준영 군은 일반중학교 재학중임에도 불구하고 성남청소년 오케스트라의 단원으로 4년째 활동하며 음악 예술을 사랑하는 진정한 이 시대 청소년의 모습을 보여주고 있습니다.",,
1238,,2022 서울시향 실내악 시리즈 IV,클래식 ,"20세기 초 작곡된 작품들을 위주로 구성된 이날 실내악 프로그램은 전쟁이 서양 음악에 어떤 변화를 가져왔는지 동시대에 작곡된 다양한 5중주를 통해 보여줄 예정이다. 1부에 연주되는 힌데미트와 프로코피예프는 1920년대 제1차 대전 이후 작곡되었다. 전쟁 이전의 전통적인 5중주와 달리, 두 작품에서 각각의 악기들은 모두 동등한 비중을 가지고 있다. 각 악장들 또한 독자적인 타이틀과 성격을 지닌다. 이는 모든 것이 파괴된 전쟁의 소용돌이 속에 음악가들이 전통적인 형식의 가치에 의문을 품었음을 보여준다. 재즈 리듬이 들려오는 힌데미트의 5중주에서는 미국의 영향이 엿보인다. 희소성의 가치를 지닌 프로코피예프의 5중주에서는 여섯 개의 악장이 저마다 동화 같은 신비로운 분위기를 풍긴다. 이는 다채로운 악기의 조합으로 서구 모더니즘도, 러시아 전통주의도 아닌 새로운 음색을 창조해낸 결과이다. 팽팽한 긴장이 이어지는 1부와 달리 본윌리엄스의 5중주가 연주되는 2부는 전쟁 이전의 평화로운 시절, 자연의 풍경으로 우리를 안내한다. 슈베르트의 유명한 ‘송어’ 5중주의 전통을 그대로 따르는 본윌리엄스의 5중주에는 그의 다른 작품에서도 찾아볼 수 있는 서정적인 선율과 다이내믹한 성격이 동시에 공존한다. 2022년은 본윌리엄스 탄생 150주년이라는 점에서 이 실내악 공연에는 또 하나의 남다른 의미를 부여할 수 있다.",,
1239,,2022 장민호＆이찬원 콘서트 “민원만족” - 전주,콘서트 ,"함께라서 더 좋은 두 남자 이야기. 웃음꽃 눈물꽃 감성꽃 모두 만개! 꽃다발같은 남자 장민호! 노래는 기본! 잘생김은 옵션! 종합선물세트같은 남자 이찬원! 일상을 더욱 특별하게 만드는 두 남자의 마술이 시작됩니다! 보석감성 노래들, 솔직담백한 이야기들이 있는 관객만족! 쌍방소통 콘서트! “민원만족”과 만나세요.",,
1240,,토끼와 자라 - 의정부,가족/아동 ,아주 먼 옛날에 남해 바다에는 용왕님을 비롯해 여러 동물들이 살고 있었어요. 바닷속과 용궁은 너무 아름답고 고요하고 평화로웠죠. 그러던 어느 날 용왕님이 병에 걸리게 되자 아름다운 바닷속은 서로 미워하며 어둡게 변해갔습니다. 그때 의사선생님은 토끼의 간을 필요로 하게 되는데 자라 대신이 육지로 나가겠다고 하는데...,,
1241,,메조소프라노 권세연 독창회,클래식 ,"메조소프라노 권세연은 고등학교 재학 중 헝가리로 건너가 부다페스트 Szilágyi Erzsébet Gimnázium을 졸업하였으며, 헝가리 부다페스트 리스트 음악대학에서 디플롬과 Postgraduate과정을 수료하였다. 서울대학교 음악대학원에서 Erkel Ferenc의 오페라 'Bánk Bán'에 관한 연구로 석사학위를 취득하였으며 이후, 프랑스로 유학하여 파리 에꼴 노르말 음악원(École Normale de Musique de Paris)에서 장학생으로 고등연주자과정을 졸업, 디플롬(Diplôme Supérieur d'Exécution)을 취득하고, 동 음악원 최고연주자과정을 수료하였다. 일찍이 연주자로서의 입지를 굳힌 권세연은 헝가리에서 Kodály Zoltán 추모 기념 음악회, 주 헝가리 한국 대사관 주최 음악회, 4인 음악회 등 다수의 음악회, 프랑스 파리에서 독창회를 비롯하여 Ensemble Alternance와 Niels Rosing-Schow <Borges 두 개의 소네트> 연주 프로젝트 참여, 현대 창작 가곡 음악회(파리 Salle Cortot) 등 현대음악에도 깊은 관심을 갖고 다양한 연주를 하였다. 2008년 귀국 독창회 이후 서울 국제 가곡제 <Nadia & Lili Boulanger>, 프랑스 가곡연구회 세미나 음악회 <프랑스 가곡의 발전>, <G. Apollinaire의 시에 의한 Poulenc의 가곡>, <Histoires Naturelles>, 부암아트홀 초청 가곡시리즈 <동유럽의 낭만>, 2012년 뮌헨 헤라쿨레스홀에서 Dacapo Kammer Philharmonie, 용인문화재단 포은아트홀 마티네 콘서트에서 Ravel의 <Shéhérazade>를 협연하였으며, 음악예술학회의 정기연주회, Duo Recital <여인의 사랑과 생애>, <Pauline Viardo et ses amis>, G.B. Pergolesi의 <Stabat Mater> 연주 등 종교음악과 헝가리, 프랑스 성악곡의 다양한 레파토리 연구와 연주를 구상하며 활발한 활동으로 관객과 함께 호흡하고 있다. 전남대학교, 침례신학대학교, 국민대학교, 나사렛대학교 강사를 역임한 권세연은 현재 성신여자대학교, 선화예술중학교, 계원예술고등학교에 출강하여 후학을 양성하고 있으며, The Pianissimo 음악예술학회 및 프랑스 가곡연구회 임원으로 다양한 무대에서 활동하고 있다. ",,
1242,,The Ordinary 콘서트 - 부산,콘서트 ,"길고 긴 터널을 지나 다시 우리 곁으로 돌아온 일상 드디어 만나게 된 우리의 평범함을 마음껏 즐기는 시간! 디핵, 제이씨 유카, 키드 와인, 스키니 브라운 이제 여러분을 찾아갑니다.",,
1243,,겨울이야기 시즌2 - 김포,가족/아동 ,"전 시즌의 사건 이후, 다시 안정을 되찾고 평화로움이 가득해진 아렌델 왕국. 그런데 어느 날, 평화롭던 아렌델의 땅이 흔들리고, 물과 불들이 춤을 추자, 아렌델은 큰 혼란에 휩싸이게 된다.",,
1244,,정혜연 귀국 플루트 독주회,클래식 ,"플루티스트 정혜연은 충북예술고등학교를 거쳐 중앙대학교 음악대학을 졸업하고, 프랑스 크레떼이 국립음악원(Conservatoire de Créteil-Marcel-Dadi) 플루트 디플롬을 심사위원 만장일치 졸업하였으며 동음악원 피콜로 과정을 수료하며 전문연주자로서 기반을 다졌다. 어린시절부터 청주 영심포니 오케스트라와 가진 플루트 협연과 청주여자중학교 오케스트라 플루트 단원으로의 활동, 충북예술고등학교 우수 신입생 연주회 등을 통해 두각을 나타낸 그는 중앙대학교 재학 시절 장천아트홀에서 가진 중앙대학교 플루티 앙상블과의 피콜로 협연을 비롯하여 예술의전당 콘서트홀에서 중앙대학교 윈드오케스트라의 피콜로, 플루트 수석 주자로서 무대에 올랐고, 세종문화회관 대극장에서 열린 중앙대학교 관현악오케스트라 신년음악회의 플루트 수석으로 공연하였음은 물론, 청주아트홀에서 충북음악협회 초청 음악회를 통해 중앙대학교 윈드오케스트라와 협연무대를 가지며 기량을 쌓았다. 솔리스트로서 출중한 연주력을 바탕으로 충북예술총연합회 주최 콩쿠르 금상, 충청대학교 주최 콩쿠르 동상, 한국플루트협회 콩쿠르 2위, 한국 영아티스트 콩쿠르 2위, 프랑스 레 끌레도르(Concours Les Clés d'or) 콩쿠르 3위, 프랑스 파리 프로디쥬 아트(Concours Prodige art) 콩쿠르 차석 등 다수의 콩쿠르에 입상하며 그 실력을 인정받았다. 뛰어난 오케스트라 플레이어로서 대한민국 국제 관악제에 피콜로 주자로 연주했고, I-cau 필하모닉 오케스트라 플루트, 서울 뉴데이 심포니 오케스트라, 인천 심포니에타 객원 수석 연주, 평택 푸코 윈드 오케스트라 객원 연주를 가졌으며 프랑스 Ensemble Latitudes 오케스트라 객원 단원, 프랑스 부르흐-라헨 국립음악원(CRD de Bourg-La-Reine) 오케스트라 플루트 수석, 프랑스 크레떼이 국립음악원(CRR de Créteil) 오케스트라 플루트 수석으로 활동했다. 또한, 프랑스 필하모니 드 파리(1001 flûtes à la Philharmonie de Paris), 바티뇰 성당(Église Ste des Batignolle), 크레떼이 성당(Église de Créteil), 부흐라헨 시청(Mairie de Bourg-la-Reine)에서 연주 및 Collège Evariste Galois에서 앙상블 초청 연주하며 전문성을 입증해보였다. 더불어 Philippe Bernold, Michel Moragues, Julien Beaudiment, Davide Formisano, Henrik Wiese, Marina Piccinini 등 세계적인 거장들의 마스터클래스에서 연주하며 음악에 대한 타고난 열정으로 끊임없는 노력을 기울이고 있다. 문록선, 이예린, 이현주, 한지은, Alain Ménard, Pascale Feuvrier, Frédéric Hochain을 사사한 플루티스트 정혜연은 예술의전당에서 개최된 제6회 한국플루트학회 신인음악회와 제14회 한국플루트협회 정기연주회 무대에 올랐고, 충북예술고등학교 플루트 마스터클래스 강사를 역임했으며 충북문화재단 청년 예술가 지원사업에 선정되어 두 번째 독주회를 오는 10월에 앞두고 있다. 후학양성에도 힘쓰고 있는 그는 현재 세종예술고등학교, 청주대학교 평생교육원 출강 중이며, 인천예고 강사, 한국플루트협회 이사, 한국플루트학회 단원으로도 활동 중이다.",,
1245,,A에서 시작되는 울림:: 데이먼스 이어 단독 콘서트,콘서트 ,앨범 커버 아트로 만난 데이먼스 이어와 유리 작가가 상상마당 춘천에서 만납니다. 언어로 전부 표현하지 못하는 것들을 자신만의 방법으로 표현하는 두 아티스트를 통해 그동안 알지 못했던 나의 다양한 감정들과 마주하면 어떨까요?,,
1246,,푸른별 구하기 프로젝트 기후위기를 노래하라 콘서트 - 대구,콘서트 ,"기후위기 현실 앞에 뮤지션들이 뭉쳤습니다. 기후위기의 심각성을 노래로 전하기 위해서요. 밴드 아프리카, 동이혼, 고니밴드, 어쿠스틱 듀오 오늘하루, 훌라가 고민하여 '기후위기를 노래하라' 무대에 오릅니다. 함께 즐길 준비 되셨나요!",,
1247,,단테콘서트-<지옥편> - 과천,연극 ,"신의 지혜를 평생 가슴에 품은 자, 단테 그는 700년 전 이탈리아에서 아무도 상상하지 못했던 사후 세계를 <신곡>에서 구축했다. 단테는 사흘 동안 온갖 괴물들과 죄인들의 참상을 목격하며 현세의 삶이 저승에 어떻게 연결되는지를 알게 된다. 수많은 예술가들에게 영감을 안겨준 단테의 신곡 중 제1편 지옥을 창작집단 움스의 장점인 연극과 무용의 절묘한 콜라보로 여러 지옥의 상황을 내레이션과 현대무용으로 지옥을 묘사하고 단테의 시적인 감성을 창의력을 충분히 표현하고 지옥을 여행을 하는 적절한 음악이 동반해 지옥을 가까이에서 체험하는 콘서트 형태로 구현해 보고자 한다. 지옥에 초대된 관객들은 지옥...",,
1248,,포르테 디 콰트로 콘서트 〈메타포닉〉 - 서울,콘서트 ,"크로스오버 그룹 포르테 디 콰트로가 또 한 번 음악적 변신을 준비한다. ‘목소리가 줄 수 있는 최고의 감동’, ‘천상의 하모니’ 등의 수식어처럼 포르테 디 콰트로는 그동안 격이 다른 하모니로 감동을 선사해왔으며, 풀오케스트라, 재즈퀄텟, 언플러그드 구성 등 매번 새로운 음악적 시도로 크로스오버가 들려줄 수 있는 음악, 그리고 소리에 대해 끊임없이 고민해왔다. 곧 선보일 정규 4집과 발매기념 콘서트인 <메타포닉>에서는 그동안 선보였던 음악과는 사뭇 다른 강렬한 미디 사운드와 미래지향적 콘셉이 돋보이는 포르테 디 콰트로 만의 음악을 준비하고있다. 포르테 디 콰트로의 음악적 고민과 도전정신이 고스란히 담...",,
1249,,유러피안 재즈 트리오 디즈니 VS 지브리 ,클래식 ,"한국인이 사랑하는 유럽의 재즈 트리오, ‘유러피안 재즈 트리오’ 내한 공연! 온화하고 멜랑꼴리한 사운드와 재즈 색깔을 입혀 색다르게 탄생한 디즈니와 스튜디오 지브리의 베스트 OST! 감미로운 원곡의 익숙함과 편곡의 새로움, 그 절묘한 조화를 느낄 수 있는 특별한 기회!",,
1250,,김희선 바이올린 리사이틀,클래식 ,"섬세하고 순수한 음색을 지닌 바이올리니스트 김희선은 예원학교, 서울예고, 연세대학교 음악대학을 우수한 성적으로 졸업하였다. 그 후, 독일 뒤셀도르프 국립음대에서는 디플롬 과정을 최우수로 졸업하였고 트로징엔 국립음대에서는 솔리스트 과정을 졸업하였다. 유년시절부터 조선일보 콩쿠르 등 다수의 입상을 하였고 대학시절 성적최우등상을 수상하여 노엽문화재단으로부터 장학생으로 선정되는 등 두각을 나타내었다. 그녀는 유학시절 독일 Haus Martinu Musik Kurs, Aurich Musik Festival, 오스트리아에서 Schloss Rabs Musik Kurs에 참가, 솔로 연주를 하였고, 뒤셀도르프 음대 Patika Saal, Robert-Schumann Saal, 트로징엔 음대 Konzert Saal 등의 콘서트홀에서 솔로 및 실내악 연주활동을 하였는데 특히 트로징엔 음대 오케스트라와의 협연은 지역일간지로부터 호평을 받았다. 뿐만아니라, Robert Schumann 캄머오케스터 단원, 트로징엔 음대 캄머오케스터 수석, Ensemble Polyphonie T-Instrumental 단원, 크로스 챔버 앙상블 수석으로 다수의 오케스트라 연주도 경험하였다. 귀국독주회 이후에도 독주회와 앙상블, 협연무대를 통해 활발한 연주활동을 하며 연주자로서의 역량을 선보이고 있다. 익산필하모닉 오케스트라, 국민대 오케스트라 등과의 협연을 가졌고 예술의전당, 금호아트홀, 영산아트홀, 꿈의숲아트센터 등에서 수차례 독주회를 개최하여 그만의 음악적 해석 능력과 표현력을 선보이고 있다. 또한 다비드 스트링 콰르텟 주자로서 활약하며 예술의전당 IBK챔버홀, 엘림아트센터, 반포심산아트홀, 산울림소극장 등 다양한 무대에도 오르고 있다. 총신대, 강남대, 남예종 강사를 역임하였고 필로스 챔버오케스트라 객원악장, 충남 교향악단 수석대행, 한국페스티벌앙상블 단원, 연세신포니에타 단원, KT챔버오케스트라 단원, 크로스 챔버 오케스트라 단원을 역임하였다. 故전창재, 정경옥, 故이종숙, 송재광, 조영미, 김수연, Rudolf Koelman, Christian Ostertag을 사사한 그녀는 현재 숭실대 출강 중이고 다비드 스트링 콰르텟 멤버로 활동 중이며 월간 음악저널 편집인 및 편집장으로 재직 중이다 ",,
1251,,장유진 피아노 독주회,클래식 ,"피아니스트 장유진은 예원학교, 서울예술고등학교를 거쳐 서울대학교 음악대학 및 동대학원, 세종대학교 박사학위를 졸업하였다. 일찍이 음악춘추사콩쿨, 조선일보콩쿨, 세라믹팔레스콩쿨, 세종음악콩쿨, 서울필하모닉콩쿨 등 다양한 국내 콩쿨을 두루 석권하며 연주자로서의 발판을 마련하였다. 또한 코리안심포니오케스트라, 코리안팝스오케스트라와의 협연을 통하여 협연자로서의 자질을 인정받았다. 무대에서의 활동뿐만 아니라 총 3장의 음반 ‘Sweet Propose’, ‘Music Letter’, ‘Self-Portrait’를 발매하여 스펙트럼을 넓혀옴과 동시에 듀오, 실내악 등에서도 두각을 나타내어 유수의 무대에서 활발히 활동해오고 있다. 세종대학교 융합예술대학원 겸임교수를 역임한 그는 현재 세종대학교 콘서바토리에서 후학을 양성 중이며 꾸준한 활동을 이어나갈 예정이다. ",,
1252,,피노키오 - 서산,가족/아동 ,마음씨 착한 제펫토 할아버지는 어느 날 피노키오라는 나무인형을 만들게 되고 가족 없이 외롭게 사는 것을 불쌍히 여긴 요정의 도움으로 피노키오는 사람과 똑같이 말을 하고 춤도 추지만 말썽을 피워 하루도 조용한 날이 없는 사고들이 생겨납니다.,,
1253,,쥐 - 수원,연극 ,"누추한 지하 창고 구석 벽에는 멈춰버린 시계와 달력이 걸려있다. 창고 구석에 조그마한 라디오 방송 시설을 해놓고 삶에 지친 사람들에게 음악과 함께 희망의 메시지를 전하는 큰아들, 그에게 그윽한 사랑의 말과 시선을 보내는 며느리.",,
1254,,먼데이프로젝트 IN 라이브클럽 [수연이 단독 콘서트],콘서트 ,〈수연이〉와 함께 살아있음을 공유하는 특별한 시간！,,
1255,,2022 Space111 매니아 패키지 - 웰킨,연극 ,"사형 선고를 받은 살인사건의 용의자, 자신이 임신 중이라며 탄원을 원하는데... 노동, 계급, 종교, 법, 성별의 공정이란 무엇일까?",,
